Lens ID,Title,Date Published,Publication Year,Publication Type,Source Title,ISSNs,Publisher,Source Country,Author/s,Abstract,Volume,Issue Number,Start Page,End Page,Fields of Study,Keywords,MeSH Terms,Chemicals,Funding,Source URLs,External URL,PMID,DOI,Microsoft Academic ID,PMCID,Citing Patents Count,References,Citing Works Count,Is Open Access,Open Access License,Open Access Colour
047-792-354-561-678,EpiK: A Knowledge Base for Epidemiological Modeling and Analytics of Infectious Diseases,2017-11-06,2017,journal article,Journal of healthcare informatics research,25094971; 2509498x,Springer Science and Business Media LLC,Switzerland,S. M. Shamimul Hasan; Edward A. Fox; Keith R. Bisset; Madhav V. Marathe,"Computational epidemiology seeks to develop computational methods to study the distribution and determinants of health-related states or events (including disease), and the application of this study to the control of diseases and other health problems. Recent advances in computing and data sciences have led to the development of innovative modeling environments to support this important goal. The datasets used to drive the dynamic models as well as the data produced by these models presents unique challenges owing to their size, heterogeneity and diversity. These datasets form the basis of effective and easy to use decision support and analytical environments. As a result, it is important to develop scalable data management systems to store, manage and integrate these datasets. In this paper, we develop EpiK—a knowledge base that facilitates the development of decision support and analytical environments to support epidemic science. An important goal is to develop a framework that links the input as well as output datasets to facilitate effective spatio-temporal and social reasoning that is critical in planning and intervention analysis before and during an epidemic. The data management framework links modeling workflow data and its metadata using a controlled vocabulary. The metadata captures information about storage, the mapping between the linked model and the physical layout, and relationships to support services. EpiK is designed to support agent-based modeling and analytics frameworks—aggregate models can be seen as special cases and are thus supported. We use semantic web technologies to create a representation of the datasets that encapsulates both the location and the schema heterogeneity. The choice of RDF as a representation language is motivated by the diversity and growth of the datasets that need to be integrated. A query bank is developed—the queries capture a broad range of questions that can be posed and answered during a typical case study pertaining to disease outbreaks. The queries are constructed using SPARQL Protocol and RDF Query Language (SPARQL) over the EpiK. EpiK can hide schema and location heterogeneity while efficiently supporting queries that span the computational epidemiology modeling pipeline: from model construction to simulation output. We show that the performance of benchmark queries varies significantly with respect to the choice of hardware underlying the database and resource description framework (RDF) engine.",1,2,260,303,Decision support system; RDF; RDF Schema; Data science; Computer science; SPARQL; Knowledge base; Analytics; Metadata; RDF query language,Computational epidemiology; Knowledge base; Mapping; RDF; SPARQL; Social contact networks,,,,https://link.springer.com/article/10.1007/s41666-017-0010-9/fulltext.html https://link.springer.com/content/pdf/10.1007%2Fs41666-017-0010-9.pdf https://link.springer.com/article/10.1007/s41666-017-0010-9 https://dblp.uni-trier.de/db/journals/jhir/jhir1.html#HasanFBM17,http://dx.doi.org/10.1007/s41666-017-0010-9,35415398,10.1007/s41666-017-0010-9,2768055609,PMC8982844,0,000-713-840-510-311; 001-180-394-015-122; 002-398-746-188-624; 002-901-926-777-894; 003-793-651-735-214; 005-010-504-208-456; 007-352-874-218-371; 008-825-106-579-151; 009-641-362-691-505; 010-491-897-968-43X; 011-199-366-997-774; 016-104-673-071-805; 016-683-339-637-163; 024-866-809-066-046; 025-735-202-565-742; 026-039-430-885-657; 028-141-288-325-045; 029-838-004-406-596; 034-036-629-493-024; 035-219-025-550-161; 039-893-574-579-426; 040-296-971-663-63X; 040-528-595-566-923; 040-546-709-875-361; 042-334-625-445-039; 042-721-748-710-816; 043-755-866-475-361; 044-056-610-413-080; 049-828-271-564-288; 049-843-022-228-780; 053-700-081-869-613; 054-227-164-521-984; 057-701-214-888-309; 058-455-722-385-463; 058-922-541-610-481; 059-185-501-020-654; 059-968-029-428-453; 060-578-931-071-884; 060-588-101-806-65X; 063-524-778-480-811; 064-412-269-820-355; 067-967-488-043-718; 073-467-777-763-371; 074-259-913-430-249; 075-839-922-555-614; 078-796-561-177-452; 080-613-857-698-879; 080-715-899-618-950; 081-758-023-279-161; 083-728-973-677-193; 085-948-700-796-696; 086-028-560-475-384; 087-440-160-638-827; 093-248-454-261-401; 101-283-475-556-497; 107-132-106-144-171; 107-812-822-819-28X; 109-812-455-158-514; 112-240-033-624-754; 113-503-253-163-505; 115-660-423-442-972; 119-820-056-297-78X; 120-602-643-015-206; 127-917-837-110-026; 128-040-095-697-97X; 137-101-586-081-080; 144-036-442-946-626; 144-245-979-014-205; 149-016-215-691-655; 152-461-526-895-907; 153-993-169-208-382; 161-066-722-383-083; 163-680-866-249-978; 165-612-349-508-378; 171-816-698-904-899; 173-013-600-432-250; 184-383-844-373-282; 198-117-349-944-144,1,true,,green
049-343-662-542-46X,Infectious Disease Genomics,,2011,book chapter,Genetics and Evolution of Infectious Disease,,Elsevier,,Yu-Tsueng Liu,"Publisher Summary The history and development of infectious disease genomics are discussed in this chapter. HGP must not be restricted to the human genome and should include model organisms including mouse, bacteria, yeast, fruit fly, and worm. The completed or ongoing genome projects will provide enormous opportunities for the discovery of novel vaccines and drug targets against human pathogens as well as the improvement of diagnosis and discovery of infectious agents and the development of new strategies for invertebrate vector control. The polysaccharide capsule is important for meningococci to escape from complement-mediated killing. With the completion of the genome sequence of a virulent MenB strain, a “reverse vaccinology” approach was applied for the development of a universal MenB vaccine by Novartis. The indispensable fatty acid synthase (FAS) pathway in bacteria has been regarded as a promising target for the development of antimicrobial agents. Through a systematic screening of 250,000 natural product extracts, a Merck team identified a potent and broad-spectrum antibiotic, platensimycin, which is derived from Streptomyces platensis. Vector Biology Network was formed to achieve three goals (1) to develop basic tools for the stable transformation of anopheline mosquitoes by the year 2000; (2) to engineer a mosquito incapable of carrying the malaria parasite by 2005; and (3) to run controlled experiments to test how to drive the engineered genotype into wild mosquito populations by 2010. The most immediate impact of a completely sequenced pathogen genome is for infectious disease diagnosis.",,,249,261,Genome; Virology; Genomics; Model organism; Whole genome sequencing; Human pathogen; Reverse vaccinology; Infectious disease (medical specialty); Computational biology; Biology; Genome project,,,,,https://www.sciencedirect.com/science/article/pii/B9780123848901000108,http://dx.doi.org/10.1016/b978-0-12-384890-1.00010-8,,10.1016/b978-0-12-384890-1.00010-8,111783866,,0,000-411-473-756-593; 001-037-464-650-921; 001-239-459-892-139; 001-375-822-977-96X; 001-437-814-415-087; 001-584-694-897-885; 002-324-631-927-739; 003-115-890-464-56X; 003-188-512-381-385; 003-448-933-145-40X; 003-710-854-332-224; 004-653-726-716-301; 005-200-872-026-047; 005-337-747-664-450; 006-222-661-250-341; 006-636-105-513-278; 007-386-355-549-983; 008-646-643-771-647; 008-972-774-575-287; 010-185-854-948-679; 012-165-717-511-811; 012-989-345-406-333; 013-913-142-716-118; 014-534-795-281-314; 015-471-014-946-039; 016-274-316-812-849; 016-509-090-704-506; 018-363-914-567-000; 019-404-540-235-136; 022-037-544-336-926; 022-587-399-297-604; 024-818-959-515-330; 025-184-271-920-869; 026-697-922-925-883; 026-840-090-408-080; 026-900-752-060-266; 027-095-783-245-21X; 028-121-405-222-902; 028-278-424-716-006; 032-210-371-605-09X; 033-353-422-317-835; 033-653-023-305-639; 034-444-816-458-323; 034-752-844-669-616; 036-463-242-765-952; 036-559-578-071-491; 036-744-943-054-847; 037-765-296-767-929; 038-270-711-499-952; 038-418-448-998-874; 038-553-755-377-818; 038-634-824-719-880; 040-171-457-010-143; 042-163-050-641-376; 042-944-931-083-652; 043-391-337-502-219; 044-143-488-906-476; 044-723-266-881-69X; 044-983-625-143-535; 045-718-647-707-484; 045-984-772-149-743; 046-875-080-460-868; 048-767-777-168-159; 051-630-951-539-439; 052-600-362-643-085; 055-891-014-076-629; 058-909-877-738-650; 061-385-147-951-672; 061-712-638-905-561; 063-252-343-472-533; 065-026-357-555-353; 067-218-889-722-094; 067-453-943-043-94X; 067-941-336-437-579; 068-646-991-287-372; 069-124-051-052-66X; 069-454-032-054-100; 072-411-320-010-530; 072-468-715-449-932; 072-486-288-838-747; 074-690-387-840-94X; 077-515-264-929-611; 077-754-382-431-169; 084-551-933-103-035; 089-291-432-133-58X; 089-665-675-580-150; 092-534-590-816-978; 095-254-063-868-138; 098-491-332-475-008; 111-572-812-561-056; 112-240-033-624-754; 114-235-222-696-307; 115-935-594-079-119; 116-184-802-287-572; 117-910-170-030-882; 119-273-136-697-716; 135-843-892-483-782; 138-244-184-808-720; 141-594-099-106-247; 143-867-261-494-81X; 147-119-230-627-255; 152-056-487-808-890; 165-045-523-049-130; 167-299-516-937-968; 183-839-942-877-122,0,true,,bronze
049-749-466-421-855,Review of Geospatial Technology for Infectious Disease Surveillance: Use Case on COVID-19,2020-08-18,2020,journal article,Journal of the Indian Society of Remote Sensing,0255660x; 09743006,Springer Science and Business Media LLC,India,Sameer Saran; Priyanka Singh; Vishal Kumar; Prakash Chauhan,"This paper discusses on the increasing relevancy of geospatial technologies such as geographic information system (GIS) in the public health domain, particularly for the infectious disease surveillance and modelling strategies. Traditionally, the disease mapping tasks have faced many challenges—(1) authors rarely documented the evidence that were used to create map, (2) before evolution of GIS, many errors aroused in mapping tasks which were expanded extremely at global scales, and (3) there were no fidelity assessment of maps which resulted in inaccurate precision. This study on infectious diseases geo-surveillance is divided into four broad sections with emphasis on handling geographical and temporal issues to help in public health decision-making and planning policies: (1) geospatial mapping of diseases using its spatial and temporal information to understand their behaviour across geography; (2) the citizen’s involvement as volunteers in giving health and disease data to assess the critical situation for disease’s spread and prevention in neighbourhood effect; (3) scientific analysis of health-related behaviour using mathematical epidemiological and geo-statistical approaches with (4) capacity building program. To illustrate each theme, recent case studies are cited and case studies are performed on COVID-19 to demonstrate selected models.",48,8,1121,1138,Geomatics; Public health; Geography; Data science; Neighbourhood effect; Fidelity; Disease; Geographic information system; Infectious disease (medical specialty); Geospatial analysis,,,,,https://link.springer.com/article/10.1007/s12524-020-01140-5 https://doi.org/10.1007/s12524-020-01140-5 https://link.springer.com/content/pdf/10.1007/s12524-020-01140-5.pdf https://paperity.org/p/256131027/review-of-geospatial-technology-for-infectious-disease-surveillance-use-case-on-covid-19 https://covid19.elsevierpure.com/de/publications/review-of-geospatial-technology-for-infectious-disease-surveillan https://pubag.nal.usda.gov/catalog/7106178,http://dx.doi.org/10.1007/s12524-020-01140-5,,10.1007/s12524-020-01140-5,3049420798,,0,000-205-709-962-40X; 000-613-491-991-111; 000-948-836-106-937; 001-547-191-052-992; 001-775-042-221-291; 002-091-718-232-361; 002-595-147-873-972; 003-015-946-321-050; 003-552-004-178-848; 003-598-939-212-347; 003-746-752-666-690; 003-807-647-184-389; 003-860-975-044-185; 004-695-784-880-359; 004-872-180-828-888; 005-216-889-911-508; 005-379-041-545-762; 005-548-993-564-383; 005-920-094-272-561; 006-757-717-854-699; 008-382-296-324-562; 008-733-518-645-153; 008-925-507-603-317; 008-971-607-014-664; 009-163-146-779-787; 009-623-642-153-104; 011-832-152-840-369; 012-586-324-585-516; 013-213-264-713-348; 013-766-452-560-609; 013-837-737-101-444; 013-871-909-271-159; 015-327-033-554-595; 015-533-375-463-703; 015-556-022-314-202; 015-583-332-066-076; 016-489-187-666-344; 017-174-131-102-697; 017-808-669-846-083; 017-970-687-617-669; 018-154-804-302-596; 018-217-706-097-053; 018-715-049-768-76X; 018-852-350-263-85X; 019-849-496-353-718; 020-551-244-928-97X; 020-746-869-530-988; 020-955-060-035-924; 021-378-081-241-662; 021-537-129-492-168; 021-605-657-344-54X; 021-723-245-554-097; 022-111-333-383-346; 022-723-646-425-014; 022-723-989-130-306; 023-111-442-014-271; 024-982-561-486-693; 025-770-602-497-463; 025-799-703-968-227; 025-948-599-640-753; 026-717-415-335-614; 026-938-164-431-714; 027-492-636-392-008; 028-014-995-275-380; 029-318-296-887-379; 030-928-755-984-666; 032-903-495-847-439; 033-279-255-282-491; 033-285-694-158-231; 033-350-480-790-686; 033-478-517-813-056; 034-875-135-261-909; 035-526-584-758-030; 035-693-688-597-17X; 036-197-982-333-857; 036-349-746-123-84X; 036-439-754-405-889; 036-459-742-842-852; 036-722-986-046-786; 036-908-967-923-89X; 037-025-204-588-664; 037-398-594-174-118; 038-814-831-065-369; 038-910-803-076-28X; 039-670-494-229-639; 040-198-635-042-261; 040-208-209-256-79X; 040-400-169-904-253; 040-688-848-620-581; 040-692-269-309-424; 041-133-673-814-823; 041-328-617-459-089; 041-454-201-567-817; 041-631-857-152-563; 044-284-973-302-245; 045-522-104-696-681; 045-714-408-683-149; 045-919-401-020-878; 046-694-299-597-022; 047-730-223-199-45X; 048-506-970-705-82X; 049-114-239-365-209; 049-177-033-711-67X; 049-226-069-799-579; 049-259-109-284-483; 049-671-569-178-061; 049-713-897-724-140; 050-494-230-798-801; 051-318-514-276-638; 051-385-467-895-38X; 052-525-639-313-429; 053-383-109-588-631; 053-514-039-593-298; 054-570-085-193-263; 054-859-619-242-072; 054-982-489-699-499; 056-019-982-944-862; 057-545-918-303-995; 057-568-295-414-817; 057-818-086-904-288; 058-446-346-128-783; 059-398-195-656-230; 059-832-892-891-171; 059-924-296-005-784; 060-803-538-129-750; 060-904-646-192-397; 062-112-768-963-759; 062-299-674-201-940; 062-494-791-604-507; 062-847-294-417-832; 063-311-294-495-284; 063-365-044-739-294; 065-197-278-655-934; 065-535-325-590-096; 066-336-138-162-728; 069-774-631-576-851; 071-347-886-510-120; 071-403-187-935-385; 071-827-642-585-823; 073-616-054-509-325; 073-877-277-270-636; 073-933-979-355-750; 074-161-577-046-057; 074-743-375-158-800; 075-973-797-470-925; 076-531-241-686-542; 076-786-164-676-117; 076-863-036-625-717; 077-592-875-451-548; 080-781-080-752-233; 081-118-560-654-582; 082-278-123-566-84X; 082-585-649-210-506; 083-015-692-014-246; 083-131-431-018-60X; 083-314-678-099-116; 083-857-456-772-388; 084-273-687-308-627; 084-639-531-581-436; 085-221-214-334-157; 086-392-099-717-437; 088-248-020-798-374; 088-683-815-052-046; 088-695-958-872-98X; 090-616-311-866-654; 091-204-512-390-272; 091-483-645-060-925; 092-197-102-933-864; 092-569-055-448-595; 093-472-194-572-401; 094-513-579-105-913; 095-133-214-301-083; 097-500-998-966-60X; 099-012-659-209-356; 099-143-487-243-602; 099-675-327-872-917; 100-016-372-318-258; 100-174-367-058-352; 103-010-917-264-205; 103-081-387-145-206; 103-508-214-259-82X; 104-728-476-540-305; 105-526-458-827-311; 106-647-796-404-458; 107-386-240-532-220; 109-917-731-823-914; 109-954-781-425-036; 112-240-033-624-754; 114-465-236-116-346; 117-251-644-324-289; 117-735-565-335-108; 124-043-027-110-303; 124-369-399-879-957; 128-100-491-888-841; 128-132-282-797-392; 128-297-585-935-68X; 129-626-369-631-850; 133-967-299-042-160; 134-615-859-741-224; 136-971-465-201-210; 137-177-061-785-481; 138-026-010-237-061; 138-673-529-421-480; 139-325-050-108-201; 139-578-853-865-789; 143-979-193-746-101; 144-308-379-888-473; 146-076-690-511-890; 147-100-422-569-774; 152-964-406-780-827; 158-839-641-039-751; 159-960-934-746-119; 161-573-087-853-811; 165-315-509-728-716; 173-414-072-450-945; 173-801-968-534-455; 174-996-158-415-103; 190-316-875-318-451; 195-200-098-457-912,15,true,,bronze
070-356-971-977-33X,Genetic Influences on Plasma Homocysteine Levels in African Americans and Yoruba Nigerians.,2015-10-30,2015,journal article,Journal of Alzheimer's disease : JAD,18758908; 13872877,IOS Press,Netherlands,Sungeun Kim; Kwangsik Nho; Vijay K. Ramanan; Dongbing Lai; Tatiana Foroud; Katie Lane; Jill R. Murrell; Sujuan Gao; Kathleen S. Hall; Frederick W. Unverzagt; Olusegun Baiyewu; Adesola Ogunniyi; Oye Gureje; Mitchel A. Kling; P. Murali Doraiswamy; Rima Kaddurah-Daouk; Hugh C. Hendrie; Andrew J. Saykin,"Plasma homocysteine, a metabolite involved in key cellular methylation processes seems to be implicated in cognitive functions and cardiovascular health with its high levels representing a potential modifiable risk factor for Alzheimer's disease (AD) and other dementias. A better understanding of the genetic factors regulating homocysteine levels, particularly in non-white populations, may help in risk stratification analyses of existing clinical trials and may point to novel targets for homocysteine-lowering therapy. To identify genetic influences on plasma homocysteine levels in individuals with African ancestry, we performed a targeted gene and pathway-based analysis using a priori biological information and then to identify new association performed a genome-wide association study. All analyses used combined data from the African American and Yoruba cohorts from the Indianapolis-Ibadan Dementia Project. Targeted analyses demonstrated significant associations of homocysteine and variants within the CBS (Cystathionine beta-Synthase) gene. We identified a novel genome-wide significant association of the AD risk gene CD2AP (CD2-associated protein) with plasma homocysteine levels in both cohorts. Minor allele (T) carriers of identified CD2AP variant (rs6940729) exhibited decreased homocysteine level. Pathway enrichment analysis identified several interesting pathways including the GABA receptor activation pathway. This is noteworthy given the known antagonistic effect of homocysteine on GABA receptors. These findings identify several new targets warranting further investigation in relation to the role of homocysteine in neurodegeneration.",49,4,991,1003,Genome-wide association study; Minor allele frequency; Cystathionine beta synthase; Homocysteine; Disease; Dementia; Risk factor; Genetics; Bioinformatics; Genetic variation; Biology,African Continental Ancestry Group; CD2-associated protein; cystathionine beta-synthase; genome-wide association study; homocysteine; metabolic networks and pathways; metabolomics,"Adaptor Proteins, Signal Transducing/genetics; African Americans/genetics; Aged; Aged, 80 and over; Blacks/genetics; Cohort Studies; Cystathionine beta-Synthase/genetics; Cytoskeletal Proteins/genetics; Female; Genetic Variation; Genome-Wide Association Study; Heterozygote; Homocysteine/blood; Humans; Indiana; Longitudinal Studies; Male; Nigeria; Prospective Studies","Adaptor Proteins, Signal Transducing; CD2-associated protein; Cytoskeletal Proteins; Homocysteine; Cystathionine beta-Synthase",NIA NIH HHS (R01 AG019771) United States; NLM NIH HHS (R00 LM011384) United States; NIA NIH HHS (P30 AG10133) United States; NIA NIH HHS (P30 AG010133) United States; NIA NIH HHS (R01 AG009956) United States; NLM NIH HHS (R01 LM011360) United States; NIA NIH HHS (AG19771) United States; NIA NIH HHS (R03 AG050856) United States; NIA NIH HHS (R01 AG09956) United States; NLM NIH HHS (R00LM011384) United States,https://www.medra.org/servlet/aliasResolver?alias=iospress&doi=10.3233/JAD-150651 https://content.iospress.com/articles/journal-of-alzheimers-disease/jad150651 https://www.ncbi.nlm.nih.gov/pubmed/26519441 http://doi.org/10.3233/JAD-150651 https://europepmc.org/article/PMC/PMC4822513 https://www.ncbi.nlm.nih.gov/pmc/articles/PMC4822513/ https://doi.org/10.3233/JAD-150651 https://core.ac.uk/download/81633909.pdf,http://dx.doi.org/10.3233/jad-150651,26519441,10.3233/jad-150651,1958017112,PMC4822513,0,000-758-525-350-150; 001-541-989-627-911; 001-664-989-439-451; 002-235-646-263-045; 002-521-435-196-572; 002-958-353-990-563; 004-470-164-157-453; 006-193-818-738-944; 006-635-819-665-420; 006-825-063-320-648; 006-850-845-527-699; 010-529-237-209-914; 010-643-346-919-56X; 010-836-224-276-886; 010-878-189-062-991; 011-528-891-017-257; 013-309-210-921-340; 014-822-666-343-124; 015-715-136-840-230; 015-773-781-698-084; 017-884-908-415-331; 020-400-878-161-506; 020-439-430-668-665; 022-057-276-882-821; 022-146-775-872-139; 022-572-932-698-317; 023-551-167-806-037; 025-199-292-086-983; 028-083-478-415-882; 031-887-913-314-325; 032-418-418-589-449; 032-871-447-670-145; 034-009-529-982-628; 034-776-724-346-157; 035-393-161-203-82X; 036-628-206-072-529; 037-060-419-804-970; 037-568-480-865-710; 040-175-838-267-231; 043-169-762-487-673; 043-431-395-354-860; 046-534-149-747-723; 052-607-522-564-135; 053-284-513-382-682; 056-123-984-082-186; 056-352-765-539-085; 058-705-305-953-844; 060-662-388-805-314; 061-898-439-846-042; 062-077-343-975-091; 063-855-484-526-227; 063-991-004-452-975; 065-212-812-028-221; 068-118-552-932-369; 068-676-131-709-712; 068-904-024-959-136; 070-293-730-598-587; 070-528-626-971-904; 071-240-627-858-982; 071-517-363-796-341; 072-313-676-885-558; 073-884-772-539-247; 076-151-942-036-783; 078-649-681-127-193; 079-337-326-982-201; 081-151-720-398-245; 082-284-524-184-712; 088-346-347-420-663; 088-602-718-460-26X; 092-659-968-037-300; 099-065-724-291-51X; 100-094-315-719-059; 101-950-823-882-851; 102-046-065-990-52X; 102-662-282-114-744; 104-262-378-350-338; 107-091-335-590-425; 108-170-506-572-902; 110-166-722-414-378; 112-240-033-624-754; 130-721-103-517-744; 140-851-783-904-569; 148-395-439-984-410; 153-981-565-926-353; 154-115-174-594-852,10,true,,green
