Lens ID,Title,Date Published,Publication Year,Publication Type,Source Title,ISSNs,Publisher,Source Country,Author/s,Abstract,Volume,Issue Number,Start Page,End Page,Fields of Study,Keywords,MeSH Terms,Chemicals,Funding,Source URLs,External URL,PMID,DOI,Microsoft Academic ID,PMCID,Citing Patents Count,References,Citing Works Count,Is Open Access,Open Access License,Open Access Colour
082-243-214-348-506,Disease Ontology: a backbone for disease semantic integration,2011-11-12,2011,journal article,Nucleic acids research,13624962; 03051048,Oxford University Press,United Kingdom,Lynn M. Schriml; Cesar Arze; Suvarna Nadendla; Yu-Wei Wayne Chang; Mark J. Mazaitis; Victor Felix; Gang Feng; Warren A. Kibbe,"The Disease Ontology (DO) database (http://disease-ontology.org) represents a comprehensive knowledge base of 8043 inherited, developmental and acquired human diseases (DO version 3, revision 2510). The DO web browser has been designed for speed, efficiency and robustness through the use of a graph database. Full-text contextual searching functionality using Lucene allows the querying of name, synonym, definition, DOID and cross-reference (xrefs) with complex Boolean search strings. The DO semantically integrates disease and medical vocabularies through extensive cross mapping and integration of MeSH, ICD, NCI's thesaurus, SNOMED CT and OMIM disease-specific terms and identifiers. The DO is utilized for disease annotation by major biomedical databases (e.g. Array Express, NIF, IEDB), as a standard representation of human disease in biomedical ontologies (e.g. IDO, Cell line ontology, NIFSTD ontology, Experimental Factor Ontology, Influenza Ontology), and as an ontological cross mappings resource between DO, MeSH and OMIM (e.g. GeneWiki). The DO project (http://diseaseontology.sf.net) has been incorporated into open source tools (e.g. Gene Answers, FunDO) to connect gene and disease biomedical data through the lens of human disease. The next iteration of the DO web browser will integrate DO's extended relations and logical definition representation along with these biomedical resource cross-mappings.",40,Database issue,940,946,Semantic integration; Open Biomedical Ontologies; SNOMED CT; Ontology-based data integration; Information retrieval; Ontology; Disease Ontology; Experimental factor ontology; Bioinformatics; Upper ontology; Biology,,"Computer Graphics; Databases, Factual; Disease/classification; Humans; Semantics; Software; Terminology as Topic; User-Computer Interface; Vocabulary, Controlled",,NCRR NIH HHS (UL1 RR025741) United States; NCRR NIH HHS (R01RR025342) United States,https://www.ncbi.nlm.nih.gov/sites/ppmc/articles/PMC3245088/ http://europepmc.org/abstract/MED/22080554 https://paperity.org/p/34539971/disease-ontology-a-backbone-for-disease-semantic-integration https://www.researchgate.net/profile/Warren_Kibbe/publication/51796080_Disease_Ontology_a_backbone_for_disease_semantic_integration/links/00b7d525da84af07b4000000.pdf https://academic.oup.com/nar/article/40/D1/D940/2903651 https://dblp.uni-trier.de/db/journals/nar/nar40.html#SchrimlANCMFFK12 http://nar.oxfordjournals.org/content/40/D1/D940.long https://pubmed.ncbi.nlm.nih.gov/22080554/ https://europepmc.org/articles/PMC3245088 https://doi.org/10.1093/nar/gkr972 http://dx.doi.org/10.1093/nar/gkr972 http://pubmed.ncbi.nlm.nih.gov/22080554/ https://www.ncbi.nlm.nih.gov/pmc/articles/PMC3245088/ http://nar.oxfordjournals.org/content/40/D1/D940.full.pdf+html https://dx.doi.org/10.1093/nar/gkr972,http://dx.doi.org/10.1093/nar/gkr972,22080554,10.1093/nar/gkr972,2159092541,PMC3245088,6,001-437-814-415-087; 006-410-513-314-68X; 011-831-311-825-058; 013-073-632-111-26X; 017-425-533-825-963; 018-967-229-298-938; 022-347-037-241-010; 023-441-309-684-622; 027-395-104-481-603; 031-013-307-062-052; 035-049-620-990-875; 046-349-456-344-014; 047-843-912-914-122; 054-270-010-924-565; 061-617-664-558-764; 062-190-817-440-625; 077-417-551-711-616; 078-456-102-890-274; 084-568-012-088-53X; 095-227-789-396-359; 098-464-500-981-732; 103-284-714-649-912; 112-240-033-624-754; 113-308-406-790-347; 120-829-522-181-781; 121-311-380-693-131; 141-796-470-058-514; 158-084-170-405-184,690,true,"CC BY, CC BY-NC",gold
089-130-812-755-981,NIASGBdb: NIAS Genebank databases for genetic resources and plant disease information,2010-10-14,2010,journal article,Nucleic acids research,13624962; 03051048,Oxford University Press,United Kingdom,Masaru Takeya; Fukuhiro Yamasaki; Shihomi Uzuhashi; Takayuki Aoki; Hiroyuki Sawada; Toshirou Nagai; Keisuke Tomioka; Norihiko Tomooka; Toyozo Sato; Makoto Kawase,"The National Institute of Agrobiological Sciences (NIAS) is implementing the NIAS Genebank Project for conservation and promotion of agrobiological genetic resources to contribute to the development and utilization of agriculture and agricultural products. The project's databases (NIASGBdb; http://www.gene.affrc.go.jp/databases_en.php) consist of a genetic resource database and a plant diseases database, linked by a web retrieval database. The genetic resources database has plant and microorganism search systems to provide information on research materials, including passport and evaluation data for genetic resources with the desired properties. To facilitate genetic diversity research, several NIAS Core Collections have been developed. The NIAS Rice (Oryza sativa) Core Collection of Japanese Landraces contains information on simple sequence repeat (SSR) polymorphisms. SSR marker information for azuki bean (Vigna angularis) and black gram (V. mungo) and DNA sequence data from some selected Japanese strains of the genus Fusarium are also available. A database of plant diseases in Japan has been developed based on the listing of common names of plant diseases compiled by the Phytopathological Society of Japan. Relevant plant and microorganism genetic resources are associated with the plant disease names by the web retrieval database and can be obtained from the NIAS Genebank for research or educational purposes.",39,Database issue,1108,1113,Agriculture; Biotechnology; Genetic marker; Diseases database; Web retrieval; Genetic resources; Plant disease; Genetic variation; Database; Genetic diversity; Biology,,"Crops, Agricultural/genetics; DNA, Fungal/chemistry; Databases, Genetic; Fusarium/genetics; Genetic Markers; Genetic Variation; Plant Diseases/microbiology","DNA, Fungal; Genetic Markers",,https://dblp.uni-trier.de/db/journals/nar/nar39.html#TakeyaYUASNTTSK11 http://nar.oxfordjournals.org/content/39/suppl_1/D1108.full.pdf http://dx.doi.org/10.1093/nar/gkq916 https://dx.doi.org/10.1093/nar/gkq916 https://core.ac.uk/display/105496407 https://academic.oup.com/nar/article/39/suppl_1/D1108/2508610 https://academic.oup.com/nar/article/39/suppl_1/D1108/2508610/NIASGBdb-NIAS-Genebank-databases-for-genetic https://www.ncbi.nlm.nih.gov/pubmed/20952407 https://paperity.org/p/34584328/niasgbdb-nias-genebank-databases-for-genetic-resources-and-plant-disease-information https://europepmc.org/articles/PMC3013781/,http://dx.doi.org/10.1093/nar/gkq916,20952407,10.1093/nar/gkq916,2111734812,PMC3013781,0,001-435-004-316-264; 004-067-234-292-141; 011-706-843-145-755; 012-066-460-747-146; 022-241-951-137-578; 028-396-206-548-224; 039-164-316-302-002; 039-506-917-444-900; 043-488-012-861-150; 045-275-616-899-663; 092-736-848-630-35X; 094-834-647-980-670; 112-240-033-624-754; 131-839-917-343-296; 147-297-783-312-597; 191-707-190-001-632,24,true,"CC BY, CC BY-NC",gold
097-767-547-325-208,Towards Structuring Unstructured GenBank Metadata for Enhancing Comparative Biological Studies.,2011-03-07,2011,journal article,AMIA Joint Summits on Translational Science proceedings. AMIA Joint Summits on Translational Science,21534063,,United States,Elizabeth S. Chen; Indra Neil Sarkar,"Within large sequence repositories such as GenBank there is a wealth of metadata providing contextual information that may enhance search and retrieval of relevant sequences for a range of subsequent analyses. One challenge is the use of free-text in these metadata fields where approaches are needed to extract, structure, and encode essential information. The goal of the present study was to explore the feasibility of using a combination of existing resources for annotating unstructured GenBank metadata, initially focusing on the “host” and “isolation_source” fields. This paper summarizes early results for 10 host organisms that include a characterization of associated isolation sources with respect to biomedical ontologies and semantic types. The findings from this preliminary study provide insights to the rich amount of information captured within these unstructured metadata, guidance for addressing the challenges and issues encountered, and highlight the potential value for enriching comparative biological studies towards improving human health.",2011,,6,10,Open Biomedical Ontologies; Structure (mathematical logic); Host (network); Isolation (database systems); Information retrieval; Structuring; Computer science; ENCODE; GenBank; Metadata,,,,NLM NIH HHS (R01 LM009725) United States,http://europepmc.org/articles/PMC3248757 https://www.ncbi.nlm.nih.gov/pubmed/22211174,https://www.ncbi.nlm.nih.gov/pubmed/22211174,22211174,,1961588674,PMC3248757,0,001-437-814-415-087; 008-895-861-187-411; 009-005-868-049-133; 024-312-992-411-447; 027-395-104-481-603; 030-949-166-132-732; 042-659-823-190-298; 060-588-101-806-65X; 064-808-719-827-310; 080-145-884-015-119; 081-344-468-188-553; 112-240-033-624-754; 177-138-245-414-473,4,true,,
119-755-856-021-812,IRI - Toward Semantic Search for the Biogeochemical Literature,,2017,conference proceedings article,2017 IEEE International Conference on Information Reuse and Integration (IRI),,IEEE,,Joshua D. Eisenberg; Deya Banisakher; Maria Presa; Kalli Unthank; Mark A. Finlayson; René M. Price; Shu-Ching Chen,"Literature search is a vital step of every research project. Semantic literature search is an approach to article retrieval and ranking using concepts rather than keywords, in an attempt to address the well-known deficiencies of keyword-based search, namely, (1) retrieval of an overwhelming number of results, (2) rankings that do not precisely reflect true relevance, and (3) the omission of relevant results because they do not contain the idiosyncratic keywords of the query. The difficulty of semantic search, however, is that it requires significant knowledge engineering, often in the form of conceptual ontologies tailored to a particular scientific domain. It also requires non-trivial tuning, in the form of domain-specific term and concepts weights. Here we present preliminary, work-in-progress results in the development of a semantic search system for the biogeochemical scientific literature. We report the following initial steps: first, one of the co-authors—a biogeochemistry expert—wrote a sample search query, and ranked the five most relevant articles that were returned for that query from a popular keyword-based search engine. We then hand annotated the five articles and the query with the Environmental Ontology (ENVO), an existing ontology for the domain. Critically, this pilot annotation revealed a number of missing concepts that we will add in future work. We then showed that a straightforward ontology distance metric between concepts in the search query and the five articles was sufficient to produce the expected ranking. We discuss the implications of these results, and outline next steps required produce a full-fledged semantic search system for the biogeochemistry scientific literature.",,,517,525,Search analytics; Web search query; Semantic search; Ontology (information science); Concept search; Information retrieval; Scientific literature; Phrase search; Computer science; Query expansion,,,,,https://ieeexplore.ieee.org/document/8102978/ https://dblp.uni-trier.de/db/conf/iri/iri2017.html#EisenbergBRUFPC17,http://dx.doi.org/10.1109/iri.2017.49,,10.1109/iri.2017.49,2768495696,,0,004-446-332-271-977; 011-241-717-579-539; 014-385-306-604-535; 015-590-928-776-066; 018-203-096-520-098; 023-827-495-739-413; 026-259-712-932-233; 042-804-479-209-954; 043-486-392-808-079; 045-163-375-516-257; 048-086-183-175-411; 055-709-566-196-991; 059-645-631-899-796; 062-161-675-998-662; 062-213-533-624-448; 075-833-304-920-488; 077-719-362-591-268; 081-282-094-792-367; 082-660-019-426-780; 086-747-172-728-010; 097-494-112-757-262; 099-766-141-639-950; 101-448-401-819-349; 112-240-033-624-754; 122-720-708-824-937; 133-865-540-546-561; 135-459-425-887-44X; 153-660-149-561-087; 174-317-175-738-222; 177-175-750-040-989,2,false,,
136-288-669-107-676,"The Pathogen-annotated Tracking Resource Network (PATRN) system: A web-based resource to aid food safety, regulatory science, and investigations of foodborne pathogens and disease",2013-01-23,2013,journal article,Food microbiology,10959998; 07400020,Academic Press Inc.,United States,Gopal R. Gopinath; K. Hari; R. Jain; Mark K. Mammel; Mahendra H. Kothary; Augusto A. Franco; Christopher J. Grim; K. G. Jarvis; Venugopal Sathyamoorthy; Lan Hu; Atin R. Datta; Isha R. Patel; Scott A. Jackson; Jayanthi Gangiredla; Michael L. Kotewicz; Joseph E. LeClerc; M. Wekell; B. A. McCardell; M. D. Solomotis; Ben D. Tall,"Abstract Investigation of foodborne diseases requires the capture and analysis of time-sensitive information on microbial pathogens that is derived from multiple analytical methods and sources. The web-based Pathogen-annotated Tracking Resource Network (PATRN) system ( www.patrn.net ) was developed to address the data aggregation, analysis, and communication needs important to the global food safety community for the investigation of foodborne disease. PATRN incorporates a standard vocabulary for describing isolate metadata and provides a representational schema for a prototypic data exchange standard using a novel data loading wizard for aggregation of assay and attribution information. PATRN currently houses expert-curated, high-quality “foundational datasets” consisting of published experimental results from conventional assays and next generation analysis platforms for isolates of Escherichia coli , Listeria monocytogenes , and Salmonella , Shigella , Vibrio and Cronobacter species. A suite of computational tools for data mining, clustering, and graphical representation is available. Within PATRN, the public curated data repository is complemented by a secure private workspace for user-driven analyses, and for sharing data among collaborators. To demonstrate the data curation, loading wizard features, and analytical capabilities of PATRN, three use-case scenarios are presented. Use-case scenario one is a comparison of the distribution and prevalence of plasmid-encoded virulence factor genes among 249 Cronobacter strains with similar attributes to that of nine Cronobacter isolates from recent cases obtained between March and October, 2010–2011. To highlight PATRN's data management and trend finding tools, analysis of datasets, stored in PATRN as part of an ongoing surveillance project to identify the predominant molecular serogroups among Cronobacter sakazakii isolates observed in the USA is shown. Use-case scenario two demonstrates the secure workspace available for private users to upload and analyze sensitive data, and for collating cross-platform datasets to identify and validate congruent datapoints. SNP datasets from WGS assemblies and pan-genome microarrays are analyzed in a combinatorial fashion to determine relatedness of 33 Salmonella enterica strains to six strains collected as part of an outbreak investigation. Use-case scenario three utilizes published surveillance results that describe the incidence and sources of O157:H7 E. coli isolates associated with a produce pre-harvest surveillance study that occurred during 2002–2006. In summary, PATRN is a web-based integrated platform containing tools for the management, analysis and visualization of data about foodborne pathogens.",34,2,303,318,Data exchange; Data management; Data science; Cronobacter sakazakii; Cronobacter; Information repository; Data aggregator; Biology; Microbiology; Data curation; Metadata,,Bacteria/classification; Data Mining; Database Management Systems/instrumentation; Food Microbiology; Food Safety/methods; Foodborne Diseases/microbiology; Humans; Information Dissemination; Information Services/instrumentation; Internet,,,https://www.sciencedirect.com/science/article/pii/S0740002013000026 https://www.ncbi.nlm.nih.gov/pubmed/23541197 https://www.cabdirect.org/cabdirect/abstract/20133168131,http://dx.doi.org/10.1016/j.fm.2013.01.001,23541197,10.1016/j.fm.2013.01.001,2114269092,,0,001-437-814-415-087; 001-903-689-381-652; 004-026-226-983-371; 004-045-907-370-339; 004-184-940-485-832; 004-366-517-549-162; 005-983-067-650-828; 007-118-610-277-663; 008-231-969-308-228; 008-748-602-939-156; 011-874-787-988-696; 013-059-630-635-640; 015-225-493-695-535; 015-930-489-228-313; 016-315-130-217-847; 016-812-841-007-907; 018-022-852-313-834; 021-514-897-004-954; 021-762-955-946-871; 021-874-228-188-564; 022-914-664-076-85X; 024-645-901-447-985; 025-934-708-849-189; 028-177-541-834-228; 028-381-637-879-138; 028-508-265-170-595; 029-640-505-327-016; 030-203-232-825-14X; 031-206-254-111-586; 031-449-512-924-376; 032-038-499-313-625; 032-401-573-898-929; 033-207-846-396-973; 035-413-713-963-081; 038-708-737-994-795; 038-842-672-177-475; 041-891-714-950-585; 044-892-489-930-214; 046-942-381-097-289; 047-570-390-544-636; 056-167-312-153-409; 056-870-310-103-808; 057-901-192-811-824; 059-333-983-697-298; 062-967-696-369-024; 063-058-095-060-441; 066-166-021-966-07X; 066-586-957-648-010; 076-985-187-928-059; 079-740-016-321-387; 081-589-879-516-422; 083-874-058-446-063; 100-840-528-972-746; 103-372-615-010-793; 109-295-070-588-457; 112-240-033-624-754; 118-543-793-180-814; 132-370-308-081-244; 146-225-248-240-852; 186-935-818-527-298,10,false,,
